100,Deep Orange-coloured Brown,https://archive.org/stream/gri_c00033125012743312#page/n73/mode/1up,Head of Pochard. Wing coverts of Sheldrake,Female Spike of Catstail Reed,,Browns,"No. 100. Deep Orange-coloured Brown, is chesnut brown, with a little reddish brown, and a small quantity of orange brown.","122,78,58",723b16,"114,59,22","24,68,27",Good,Photoshop autotone and color balance adjust 100px eyedropper sample,https://archive.org/download/gri_c00033125012743312/gri_c00033125012743312_jp2.zip/gri_c00033125012743312_jp2%2Fgri_c00033125012743312_0073.jpg
101,Deep Reddish Brown,https://archive.org/stream/gri_c00033125012743312#page/n73/mode/1up,"Breast of Pochard, and Neck of Teal Drake",Dead Leaves of green Panic Grass,Brown Blende,Browns,"101. Deep Reddish Brown, is chesnut brown, with a little chocolate red.","95,60,60",4d2a17,"77,42,23","21,54,20",Good,Photoshop autotone and color balance adjust 100px eyedropper sample,https://archive.org/download/gri_c00033125012743312/gri_c00033125012743312_jp2.zip/gri_c00033125012743312_jp2%2Fgri_c00033125012743312_0073.jpg
102,Umber Brown,https://archive.org/stream/gri_c00033125012743312#page/n73/mode/1up,Moor Buzzard,Disk of Rubeckia,,Browns,"102. Umber Brown, is chesnut brown, with a little blackish brown. ","88,68,60",443116,"68,49,22","35,51,18",Good,Photoshop autotone and color balance adjust 100px eyedropper sample,https://archive.org/download/gri_c00033125012743312/gri_c00033125012743312_jp2.zip/gri_c00033125012743312_jp2%2Fgri_c00033125012743312_0073.jpg
103,Chesnut Brown,https://archive.org/stream/gri_c00033125012743312#page/n73/mode/1up,Neck and Breast of Red Grouse,Chesnuts,Egyptian Jasper,Browns,"103. Chesnut Brown, the characteristic colour of the browns of Werner's series, W. is deep reddish brown and yellowish brown.","114,78,64",69411d,"105,65,29","28,57,26",Good,Photoshop autotone and color balance adjust 100px eyedropper sample,https://archive.org/download/gri_c00033125012743312/gri_c00033125012743312_jp2.zip/gri_c00033125012743312_jp2%2Fgri_c00033125012743312_0073.jpg
104,Yellowish Brown,https://archive.org/stream/gri_c00033125012743312#page/n73/mode/1up,"Light Brown Spots on Guinea-Pig, Breast of Hoopoe",,Iron Flint and common Jasper,Browns,"104. Yellowish Brown, is chesnut brown mixed with a considerable portion of lemon yellow. W. ","138,110,72",87662a,"135,102,42","39,53,35",Good,Photoshop autotone and color balance adjust 100px eyedropper sample,https://archive.org/download/gri_c00033125012743312/gri_c00033125012743312_jp2.zip/gri_c00033125012743312_jp2%2Fgri_c00033125012743312_0073.jpg
105,Wood Brown,https://archive.org/stream/gri_c00033125012743312#page/n73/mode/1up,"Common Weasel, Light parts of Feathers on the Back of the Snipe",Hazel Nuts,Mountian Wood,Browns,"No. 105. WoodBrown, is yellowish brown mixed with ash grey.","186,158,112",c0a666,"192,166,102","43,42,58",Good,Photoshop autotone and color balance adjust 100px eyedropper sample,https://archive.org/download/gri_c00033125012743312/gri_c00033125012743312_jp2.zip/gri_c00033125012743312_jp2%2Fgri_c00033125012743312_0073.jpg
106,Liver Brown,https://archive.org/stream/gri_c00033125012743312#page/n73/mode/1up,"Middle Parts of Feathers of Hen Pheasant, and Wing coverts of Grosbeak",,Semi Opal,Browns,"106. Liver Brown, is chesnut brown mixed with a little black and olive green. ","83,68,58",3f3114,"63,49,20","40,52,16",Good,Photoshop autotone and color balance adjust 100px eyedropper sample,https://archive.org/download/gri_c00033125012743312/gri_c00033125012743312_jp2.zip/gri_c00033125012743312_jp2%2Fgri_c00033125012743312_0073.jpg
107,Hair Brown,https://archive.org/stream/gri_c00033125012743312#page/n73/mode/1up,Head of Pintail Duck,,Wood Tin,Browns,"107. Hair Brown, is clove brown mixed with ash grey. W.","134,118,92",827748,"130,119,72","49,29,40",Good,Photoshop autotone and color balance adjust 100px eyedropper sample,https://archive.org/download/gri_c00033125012743312/gri_c00033125012743312_jp2.zip/gri_c00033125012743312_jp2%2Fgri_c00033125012743312_0073.jpg
108,Broccoli Brown,https://archive.org/stream/gri_c00033125012743312#page/n73/mode/1up,Head of Black headed Gull,,Zircon,Browns,"108. Broccoli Brown, is clove brown mixed with ash grey, and a small tinge of red. W.","150,132,110",958762,"149,135,98","44,21,48",Good,Photoshop autotone and color balance adjust 100px eyedropper sample,https://archive.org/download/gri_c00033125012743312/gri_c00033125012743312_jp2.zip/gri_c00033125012743312_jp2%2Fgri_c00033125012743312_0073.jpg
109,Olive Brown,https://archive.org/stream/gri_c00033125012743312#page/n73/mode/1up,Head and Neck of Male Kestril,Stems of Black Currant Bush,"Axinite, Rock Cristal",Browns,"109. Olive Brown, is ash grey mixed with a little blue, red, and chesnut brown. W. ","119,100,84",6b5c3d,"107,92,61","40,27,33",Good,Photoshop autotone and color balance adjust 100px eyedropper sample,https://archive.org/download/gri_c00033125012743312/gri_c00033125012743312_jp2.zip/gri_c00033125012743312_jp2%2Fgri_c00033125012743312_0073.jpg
110,Blackish Brown,https://archive.org/stream/gri_c00033125012743312#page/n73/mode/1up,"Stormy Petril, Wing Coverts of black Cock. Forehead of Foumart",,Mineral Pitch,Browns,"110. Blackish Brown, is composed of chesnut brown and black. W. ","70,65,56",342e14,"52,46,20","49,44,14",Good,Photoshop autotone and color balance adjust 100px eyedropper sample,https://archive.org/download/gri_c00033125012743312/gri_c00033125012743312_jp2.zip/gri_c00033125012743312_jp2%2Fgri_c00033125012743312_0073.jpg