50,Verdigris Green,https://archive.org/stream/gri_c00033125012743312#page/n49/mode/1up,Tail of small Long-tailed Green Parrot,,Copper Green,Greens,"50. Verdigris Green, is composed of emerald green, much Berlin blue, and a little white. W. ","124,173,137",71aa89,"113,170,137","145,25,55",Bad,Photoshop autotone and color balance adjust 100px eyedropper sample,https://archive.org/download/gri_c00033125012743312/gri_c00033125012743312_jp2.zip/gri_c00033125012743312_jp2%2Fgri_c00033125012743312_0049.jpg
51,Bluish Green,https://archive.org/stream/gri_c00033125012743312#page/n49/mode/1up,Egg of Thrush,Under Disk of Wild Rose Leaves,Beryl,Greens,"No. 51. Bluish Green, is composed of Berlin blue, and a little lemon yellow and greyish white.","171,180,166",a4b3a6,"164,179,166","128,9,67",Bad,Photoshop autotone and color balance adjust 100px eyedropper sample,https://archive.org/download/gri_c00033125012743312/gri_c00033125012743312_jp2.zip/gri_c00033125012743312_jp2%2Fgri_c00033125012743312_0049.jpg
52,Apple Green,https://archive.org/stream/gri_c00033125012743312#page/n49/mode/1up,Under Side of Wings of Green Broom Moth,,Crysoprase,Greens,"52 Apple Green, is emerald green mixed with a little greyish white. W. ","178,188,156",abb796,"171,183,150","82,19,65",Bad,Photoshop autotone and color balance adjust 100px eyedropper sample,https://archive.org/download/gri_c00033125012743312/gri_c00033125012743312_jp2.zip/gri_c00033125012743312_jp2%2Fgri_c00033125012743312_0049.jpg
53,Emerald Green,https://archive.org/stream/gri_c00033125012743312#page/n49/mode/1up,Beauty Spot on Wing of Teal Drake,,Emerald,Greens,"53. Emerald Green, is the characteristic colour of Werner ; he gives no description of the component parts of any of the characteristic colours ; it is composed of about equal parts of Berlin blue and gamboge yellow. ","160,184,124",97b578,"151,181,120","90,29,59",Bad,Photoshop autotone and color balance adjust 100px eyedropper sample,https://archive.org/download/gri_c00033125012743312/gri_c00033125012743312_jp2.zip/gri_c00033125012743312_jp2%2Fgri_c00033125012743312_0049.jpg
54,Grass Green,https://archive.org/stream/gri_c00033125012743312#page/n52/mode/1up,Scarabœus Nobilis,General Appearance of Grass Fields. Sweet Sugar Pear,Uran Mica,Greens,"54. Grass Green, is emerald green mixed with a little lemon yellow. W.","134,140,90",86996d,"134,153,109","86,18,51",OK,Photoshop autotone and color balance adjust 100px eyedropper sample,https://archive.org/download/gri_c00033125012743312/gri_c00033125012743312_jp2.zip/gri_c00033125012743312_jp2%2Fgri_c00033125012743312_0052.jpg
55,Duck Green,https://archive.org/stream/gri_c00033125012743312#page/n52/mode/1up,Neck of Mallard,Upper Disk of Yew Leaves,Ceyanite,Greens,"55. Duck Green, W. a new colour of Werner's, added since the publication of his nomenclature ; it is composed of emerald green, with a little indigo blue, much gamboge yellow, and a very little carmine red.","61,70,39",334429,"51,68,41","98,25,21",OK,Photoshop autotone and color balance adjust 100px eyedropper sample,https://archive.org/download/gri_c00033125012743312/gri_c00033125012743312_jp2.zip/gri_c00033125012743312_jp2%2Fgri_c00033125012743312_0052.jpg
56,Sap Green,https://archive.org/stream/gri_c00033125012743312#page/n52/mode/1up,Under Side of Lower Wings of Orange tip Butterfly,Upper Disk of Leaves of woody Night Shade,,Greens,"No. 56. Sap Green, is emerald green, with much saffron yellow, and a little chesnut brown.","128,136,65",829249,"130,146,73","73,33,43",OK,Photoshop autotone and color balance adjust 100px eyedropper sample,https://archive.org/download/gri_c00033125012743312/gri_c00033125012743312_jp2.zip/gri_c00033125012743312_jp2%2Fgri_c00033125012743312_0052.jpg
57,Pistachio Green,https://archive.org/stream/gri_c00033125012743312#page/n52/mode/1up,Neck of Eider Drake,Ripe Pound Pear. Hypnum like Saxifrage,Crysolite,Greens,"57. Pistachio Green, is emerald green mixed with a little lemon yellow, and a small quantity of brown. W. ","146,152,81",98a760,"152,167,96","73,29,52",OK,Photoshop autotone and color balance adjust 100px eyedropper sample,https://archive.org/download/gri_c00033125012743312/gri_c00033125012743312_jp2.zip/gri_c00033125012743312_jp2%2Fgri_c00033125012743312_0052.jpg
58,Asparagus Green,https://archive.org/stream/gri_c00033125012743312#page/n52/mode/1up,Brimstone Butterfly,Variegated Horse-Shoe Geranium,Beryl,Greens,"58. Asparagus Green, is pistachio green, mixed with much greyish white. W.","194,194,147",d0d9b9,"208,217,185","77,30,79",OK,Photoshop autotone and color balance adjust 100px eyedropper sample,https://archive.org/download/gri_c00033125012743312/gri_c00033125012743312_jp2.zip/gri_c00033125012743312_jp2%2Fgri_c00033125012743312_0052.jpg
59,Olive Green,https://archive.org/stream/gri_c00033125012743312#page/n52/mode/1up,,Foliage of Lignum vitæ,Epidote olvene Ore,Greens,"59. Olive Green, is grass green mixed with much brown. W. ","110,120,98",6d7f75,"109,127,117","147,8,46",OK,Photoshop autotone and color balance adjust 100px eyedropper sample,https://archive.org/download/gri_c00033125012743312/gri_c00033125012743312_jp2.zip/gri_c00033125012743312_jp2%2Fgri_c00033125012743312_0052.jpg
60,Oil Green,https://archive.org/stream/gri_c00033125012743312#page/n52/mode/1up,Animal and Shell of common Water Snail,Nonpareil Apple from the Wall,Beryl,Greens,"60. Oil Green, is emerald green mixed with lemon yellow, chesnut brown, and yellowish grey. W.","165,146,80",ad9f61,"173,159,97","49,32,53",OK,Photoshop autotone and color balance adjust 100px eyedropper sample,https://archive.org/download/gri_c00033125012743312/gri_c00033125012743312_jp2.zip/gri_c00033125012743312_jp2%2Fgri_c00033125012743312_0052.jpg
61,Siskin Green,https://archive.org/stream/gri_c00033125012743312#page/n52/mode/1up,Siskin,Ripe Coalmar Pear. Irish Pitcher Apple,Uran Mica,Greens,"61. Siskin Green, is emerald green mixed with much lemon yellow, and a little yellowish white. W.","203,200,116",d7e090,"215,224,144","67,56,72",OK,Photoshop autotone and color balance adjust 100px eyedropper sample,https://archive.org/download/gri_c00033125012743312/gri_c00033125012743312_jp2.zip/gri_c00033125012743312_jp2%2Fgri_c00033125012743312_0052.jpg
62,Sulphur Yellow,https://archive.org/stream/gri_c00033125012743312#page/n56/mode/1up,Yellow Parts of large Dragon Fly,Various Coloured Snap dragon,Sulphur,Yellows,"No. 62. Sulphur Yellow, is lemon yellow mixed with emerald green and white. W.","202,196,92",e2d943,"266,217,67","45,112,65",OK,Photoshop autotone and color balance adjust 100px eyedropper sample,https://archive.org/download/gri_c00033125012743312/gri_c00033125012743312_jp2.zip/gri_c00033125012743312_jp2%2Fgri_c00033125012743312_0056.jpg
63,Primrose Yellow,https://archive.org/stream/gri_c00033125012743312#page/n56/mode/1up,Pale Canary Bird,Wild Primrose,Pale coloured Sulphur,Yellows,"63. Primrose Yellow, is gamboge yellow mixed with a little sulphur yellow, and much snow white.","232,220,156",fffeb2,"255,254,178","59,100,85",OK,Photoshop autotone and color balance adjust 100px eyedropper sample,https://archive.org/download/gri_c00033125012743312/gri_c00033125012743312_jp2.zip/gri_c00033125012743312_jp2%2Fgri_c00033125012743312_0056.jpg
64,Wax Yellow,https://archive.org/stream/gri_c00033125012743312#page/n56/mode/1up,Larva of large Water Beetle,Greenish Parts of Nonpareil Apple,Semi Opal,Yellows,"64. Wax Yellow, is composed of lemon yellow, reddish brown, and a little ash grey. W.","166,148,78",bd9e32,"189,158,50","47,58,47",OK,Photoshop autotone and color balance adjust 100px eyedropper sample,https://archive.org/download/gri_c00033125012743312/gri_c00033125012743312_jp2.zip/gri_c00033125012743312_jp2%2Fgri_c00033125012743312_0056.jpg
65,Lemon Yellow,https://archive.org/stream/gri_c00033125012743312#page/n56/mode/1up,Large Wasp or Hornet,Shrubby Goldylocks,Yellow Orpiment,Yellows,"63. Lemon Yellow, the characteristic colour of the yellow series of Werner, the colour of ripe lemons ; W. it is found to be a mixture of gamboge yellow and a little ash grey : being a mixed colour, it cannot be adopted as the characteristic colour ; the characteristic colours of the blues, reds, and yellows ought to be pure and free from all intermixture with anyother colour ; gamboge, as the purest yellow colour, is adopted instead of lemon yellow, as the characteristic colour of the yellows.","215,196,108",f0dd5d,"240,221,93","52,83,65",OK,Photoshop autotone and color balance adjust 100px eyedropper sample,https://archive.org/download/gri_c00033125012743312/gri_c00033125012743312_jp2.zip/gri_c00033125012743312_jp2%2Fgri_c00033125012743312_0056.jpg
66,Gamboge Yellow,https://archive.org/stream/gri_c00033125012743312#page/n56/mode/1up,Wings of Goldfinch. Canary Bird,Yellow Jasmine,High coloured Sulphur,Yellows,"No. 66. Gamboge Yellow, is the characteristic colour. ","226,208,98",fbef4e,"251,239,78","56,96,65",OK,Photoshop autotone and color balance adjust 100px eyedropper sample,https://archive.org/download/gri_c00033125012743312/gri_c00033125012743312_jp2.zip/gri_c00033125012743312_jp2%2Fgri_c00033125012743312_0056.jpg
67,Kings Yellow,https://archive.org/stream/gri_c00033125012743312#page/n56/mode/1up,Head of Golden Pheasant,Yellow Tulip. Cinque foil,,Yellows,"67. King's Yellow, is gamboge yellow, with a small portion of saffron yellow.","231,212,108",fff762,"255,247,98","57,100,69",OK,Photoshop autotone and color balance adjust 100px eyedropper sample,https://archive.org/download/gri_c00033125012743312/gri_c00033125012743312_jp2.zip/gri_c00033125012743312_jp2%2Fgri_c00033125012743312_0056.jpg
68,Saffron Yellow,https://archive.org/stream/gri_c00033125012743312#page/n56/mode/1up,Tail Coverts of Golden Pheasant,Anthers of Saffron Crocus,,Yellows,"68. Saffron Yellow, is gamboge yellow, with gallstone yellow, about equal parts of each.","194,158,56",dea916,"222,169,22","44,82,48",OK,Photoshop autotone and color balance adjust 100px eyedropper sample,https://archive.org/download/gri_c00033125012743312/gri_c00033125012743312_jp2.zip/gri_c00033125012743312_jp2%2Fgri_c00033125012743312_0056.jpg
69,Gallstone Yellow,https://archive.org/stream/gri_c00033125012743312#page/n59/mode/1up,Gallstones,Marigold Apple,,Yellows,"69. Gallstone Yellow, is gamboge yellow, with a small quantity of Dutch orange, and a minute proportion of honey yellow.","150,104,50",a56700,"165,103,0","37,100,32",OK,Photoshop autotone and color balance adjust 100px eyedropper sample,https://archive.org/download/gri_c00033125012743312/gri_c00033125012743312_jp2.zip/gri_c00033125012743312_jp2%2Fgri_c00033125012743312_0059.jpg
70,Honey Yellow,https://archive.org/stream/gri_c00033125012743312#page/n59/mode/1up,Lower Parts of Neck of Bird of Paradise,,Fluor Spar,Yellows,"No. 70. Honey Yellow, is sulphur yellow mixed with chesnut brown. W.","158,128,66",ad8404,"173,132,4","45,95,35",OK,Photoshop autotone and color balance adjust 100px eyedropper sample,https://archive.org/download/gri_c00033125012743312/gri_c00033125012743312_jp2.zip/gri_c00033125012743312_jp2%2Fgri_c00033125012743312_0059.jpg
71,Straw Yellow,https://archive.org/stream/gri_c00033125012743312#page/n59/mode/1up,Polar Bear,Oat Straw,Schorlite Calamine,Yellows,"71. Straw Yellow, is sulphur yellow mixed with much greyish white and a little ochre yellow. W. ","235,212,152",fdf096,"253,240,150","52,96,79",OK,Photoshop autotone and color balance adjust 100px eyedropper sample,https://archive.org/download/gri_c00033125012743312/gri_c00033125012743312_jp2.zip/gri_c00033125012743312_jp2%2Fgri_c00033125012743312_0059.jpg
72,Wine Yellow,https://archive.org/stream/gri_c00033125012743312#page/n59/mode/1up,Body of Silk Moth,White Currants,Saxon Topaz,Yellows,"72. Wine Yellow, is sulphur yellow mixed with reddish brown and grey, with much snow white. W.","214,196,138",e5db75,"229,219,117","55,68,68",OK,Photoshop autotone and color balance adjust 100px eyedropper sample,https://archive.org/download/gri_c00033125012743312/gri_c00033125012743312_jp2.zip/gri_c00033125012743312_jp2%2Fgri_c00033125012743312_0059.jpg
73,Sienna Yellow,https://archive.org/stream/gri_c00033125012743312#page/n59/mode/1up,Vent Parts of Tail of Bird of Paradise,Stamina of Honey-suckle,Pale Brazilian Topaz,Yellows,"73. Sienna Yellow, is primrose yellow, with a little ochre yellow.","235,212,142",fdec85,"253,236,133","52,97,76",OK,Photoshop autotone and color balance adjust 100px eyedropper sample,https://archive.org/download/gri_c00033125012743312/gri_c00033125012743312_jp2.zip/gri_c00033125012743312_jp2%2Fgri_c00033125012743312_0059.jpg
74,Ochre Yellow,https://archive.org/stream/gri_c00033125012743312#page/n59/mode/1up,Vent Coverts of Red Start,,Porcelain Jasper,Yellows,"74. Ochre Yellow, is sienna yellow, with a little light chesnut brown. W.","231,204,136",fbe573,"251,229,115","50,94,72",OK,Photoshop autotone and color balance adjust 100px eyedropper sample,https://archive.org/download/gri_c00033125012743312/gri_c00033125012743312_jp2.zip/gri_c00033125012743312_jp2%2Fgri_c00033125012743312_0059.jpg
75,Cream Yellow,https://archive.org/stream/gri_c00033125012743312#page/n59/mode/1up,Breast of Teal Drake,,Porcelain Jasper,Yellows,"75. Cream Yellow, is ochre yellow mixed with a little white, and a very small quantity of Dutch orange. W.","238,220,170",fff6ba,"255,246,186","52,100,86",OK,Photoshop autotone and color balance adjust 100px eyedropper sample,https://archive.org/download/gri_c00033125012743312/gri_c00033125012743312_jp2.zip/gri_c00033125012743312_jp2%2Fgri_c00033125012743312_0059.jpg
76,Dutch Orange,https://archive.org/stream/gri_c00033125012743312#page/n63/mode/1up,Crest of Golden crested Wren,Common Marigold. Seedpod of Spindle-tree,Streak of Red Orpiment,Orange,"No. 76. Dutch Orange, the orange yellow of Werner, is gamboge yellow, with carmine red. W.","212,168,72",f3af00,"243,175,0","43,100,48",OK,Photoshop autotone and color balance adjust 100px eyedropper sample,https://archive.org/download/gri_c00033125012743312/gri_c00033125012743312_jp2.zip/gri_c00033125012743312_jp2%2Fgri_c00033125012743312_0063.jpg
77,Buff Orange,https://archive.org/stream/gri_c00033125012743312#page/n63/mode/1up,Streak from the Eye of the King Fisher,Stamina of the large White Cistus,Natrolite,Orange,"77. Buff Orange, is sienna yellow, with a little Dutch Orange.","227,188,118",fecf19,"254,107,25","21,99,55",OK,Photoshop autotone and color balance adjust 100px eyedropper sample,https://archive.org/download/gri_c00033125012743312/gri_c00033125012743312_jp2.zip/gri_c00033125012743312_jp2%2Fgri_c00033125012743312_0063.jpg
78,Orpiment Orange,https://archive.org/stream/gri_c00033125012743312#page/n63/mode/1up,"The Neck Ruff of the Golden Pheasant, Belly of the Warty Newt",Indian Cress,,Orange,"78. Orpiment Orange, the characteristic colour, is about equal parts of gamboge yellow and arterial blood red.","190,126,74",e27000,"226,112,0","30,100,44",OK,Photoshop autotone and color balance adjust 100px eyedropper sample,https://archive.org/download/gri_c00033125012743312/gri_c00033125012743312_jp2.zip/gri_c00033125012743312_jp2%2Fgri_c00033125012743312_0063.jpg
79,Brownish Orange,https://archive.org/stream/gri_c00033125012743312#page/n63/mode/1up,Eyes of the largest Flesh Fly,Style of the Orange Lily,Dark Brazilian Topaz,Orange,"79. Brownish Orange, is orpiment orange, with a little hyacinth red, and a small quantity of light chesnut brown. ","133,74,54",a62500,"166,37,0","13,100,33",OK,Photoshop autotone and color balance adjust 100px eyedropper sample,https://archive.org/download/gri_c00033125012743312/gri_c00033125012743312_jp2.zip/gri_c00033125012743312_jp2%2Fgri_c00033125012743312_0063.jpg
80,Reddish Orange,https://archive.org/stream/gri_c00033125012743312#page/n63/mode/1up,Lower Wings of Tyger Moth,Hemimeris Buff Hibiscus,,Orange,"80. Reddish Orange, is buff orange mixed with a considerable portion of tile red.","175,116,80",d16200,"209,98,0","28,100,41",OK,Photoshop autotone and color balance adjust 100px eyedropper sample,https://archive.org/download/gri_c00033125012743312/gri_c00033125012743312_jp2.zip/gri_c00033125012743312_jp2%2Fgri_c00033125012743312_0063.jpg
81,Deep Reddish Orange,https://archive.org/stream/gri_c00033125012743312#page/n63/mode/1up,Gold Fish lustre abstracted,Scarlet Leadington Apple,,Orange,"81. Deep Reddish Orange, is Dutch orange mixed with much scarlet red.","168,99,65",cc4700,"204,71,0","21,100,40",OK,Photoshop autotone and color balance adjust 100px eyedropper sample,https://archive.org/download/gri_c00033125012743312/gri_c00033125012743312_jp2.zip/gri_c00033125012743312_jp2%2Fgri_c00033125012743312_0063.jpg
82,Tile Red,https://archive.org/stream/gri_c00033125012743312#page/n66/mode/1up,Breast of the Cock Bullfinch,Shrubby Pimpernel,Porcelain Jasper,Red,"No. 82. Tile Red, is hyacinth red mixed with much greyish white, and a small portion of scarlet red. W.","182,108,78",d05438,"208,84,65","8,60,54",Good,Photoshop autotone and color balance adjust 100px eyedropper sample,https://archive.org/download/gri_c00033125012743312/gri_c00033125012743312_jp2.zip/gri_c00033125012743312_jp2%2Fgri_c00033125012743312_0066.jpg
83,Hyacinth Red,https://archive.org/stream/gri_c00033125012743312#page/n66/mode/1up,Red Spots of the Lygœus Apterus Fly,Red on the golden Rennette Apple,Hyacinth,Red,"83. Hyacinth Red, is scarlet red, with lemon yellow and a minute proportion of brown.","151,90,60",af3b23,"175,59,35","10,67,41",Good,Photoshop autotone and color balance adjust 100px eyedropper sample,https://archive.org/download/gri_c00033125012743312/gri_c00033125012743312_jp2.zip/gri_c00033125012743312_jp2%2Fgri_c00033125012743312_0066.jpg
84,Scarlet Red,https://archive.org/stream/gri_c00033125012743312#page/n66/mode/1up,"Scarlet Ibis or Curlew, Mark on Head of Red Grouse","Large red Oriental Poppy, Red Parts of red and black Indian Peas",Light red Cinnaber,Red,"84. Scarlet Red, is arterial blood red, with a little gamboge yellow. ","160,67,59",ba1f21,"186,31,33","359,71,43",Good,Photoshop autotone and color balance adjust 100px eyedropper sample,https://archive.org/download/gri_c00033125012743312/gri_c00033125012743312_jp2.zip/gri_c00033125012743312_jp2%2Fgri_c00033125012743312_0066.jpg
85,Vermillion Red,https://archive.org/stream/gri_c00033125012743312#page/n66/mode/1up,Red Coral,Love Apple,Cinnaber,Red,"85. Vermilion Red, is scarlet red, with a minute portion of brownish red.","163,76,66",bc2d27,"188,45,39","2,66,45",Good,Photoshop autotone and color balance adjust 100px eyedropper sample,https://archive.org/download/gri_c00033125012743312/gri_c00033125012743312_jp2.zip/gri_c00033125012743312_jp2%2Fgri_c00033125012743312_0066.jpg
86,Aurora Red,https://archive.org/stream/gri_c00033125012743312#page/n66/mode/1up,Vent converts of Pied Wood-Pecker,Red on the Naked Apple,Red Orpiment,Red,"86. Aurora Red, is tile red, with a little arterial blood red, and. a slight tinge of carmine red. W. ","186,110,92",d65848,"214,88,72","7,63,56",Good,Photoshop autotone and color balance adjust 100px eyedropper sample,https://archive.org/download/gri_c00033125012743312/gri_c00033125012743312_jp2.zip/gri_c00033125012743312_jp2%2Fgri_c00033125012743312_0066.jpg
87,Arterial Blood Red,https://archive.org/stream/gri_c00033125012743312#page/n66/mode/1up,Head of the Cock Gold-finch,Corn Poppy. Cherry,,Red,"87. Arterial Blood Red, is the characteristic colour of the red series. ","102,28,34",730004,"115,0,4","358,100,23",Good,Photoshop autotone and color balance adjust 100px eyedropper sample,https://archive.org/download/gri_c00033125012743312/gri_c00033125012743312_jp2.zip/gri_c00033125012743312_jp2%2Fgri_c00033125012743312_0066.jpg
88,Flesh Red,https://archive.org/stream/gri_c00033125012743312#page/n66/mode/1up,Human Skin,Larkspur,"Heavy Spar, Limestone",Red,"No. 88. Flesh Red, is rose red mixed with tile red and a little white. W.","224,196,156",fed0a4,"254,208,164","29,98,82",Good,Photoshop autotone and color balance adjust 100px eyedropper sample,https://archive.org/download/gri_c00033125012743312/gri_c00033125012743312_jp2.zip/gri_c00033125012743312_jp2%2Fgri_c00033125012743312_0066.jpg
89,Rose Red,https://archive.org/stream/gri_c00033125012743312#page/n66/mode/1up,,Common Garden Rose,Figure Stone,Red,"89. Rose Red, is carmine red, with a great quantity of snow white, and a very small portion of cochineal red. W.","239,220,196",fff2dc,"255,242,220","38,100,93",Good,Photoshop autotone and color balance adjust 100px eyedropper sample,https://archive.org/download/gri_c00033125012743312/gri_c00033125012743312_jp2.zip/gri_c00033125012743312_jp2%2Fgri_c00033125012743312_0066.jpg
90,Peach Blossom Red,https://archive.org/stream/gri_c00033125012743312#page/n66/mode/1up,,Peach Blossom,Red Cobalt Ore,Red,"90. Peach Blossom Red, is lake red mixed with much white. W.","230,204,194",ffe1d6,"255,225,214","16,100,92",Good,Photoshop autotone and color balance adjust 100px eyedropper sample,https://archive.org/download/gri_c00033125012743312/gri_c00033125012743312_jp2.zip/gri_c00033125012743312_jp2%2Fgri_c00033125012743312_0066.jpg
91,Carmine Red,https://archive.org/stream/gri_c00033125012743312#page/n69/mode/1up,,"Raspberry, Cocks Comb, Carnation Pink",Oriental Ruby,Red,"91. Carmine Red, the characteristic colour of Werner, is lake red, with a little arterial blood red. W.","182,86,110",ec153e,"236,21,62","349,85,50",OK,Photoshop autotone and color balance adjust 100px eyedropper sample,https://archive.org/download/gri_c00033125012743312/gri_c00033125012743312_jp2.zip/gri_c00033125012743312_jp2%2Fgri_c00033125012743312_0069.jpg
92,Lake Red,https://archive.org/stream/gri_c00033125012743312#page/n69/mode/1up,,"Red Tulip, Rose Officinalus",Spinel,Red,"92. Lake Red, the crimson red of Werner, is arterial blood red, with a portion of Berlin blue. W ","163,76,112",da0d44,"218,13,68","344,89,45",OK,Photoshop autotone and color balance adjust 100px eyedropper sample,https://archive.org/download/gri_c00033125012743312/gri_c00033125012743312_jp2.zip/gri_c00033125012743312_jp2%2Fgri_c00033125012743312_0069.jpg
93,Crimson Red,https://archive.org/stream/gri_c00033125012743312#page/n69/mode/1up,,,Precious Garnet,Red,"93. Crimson Red, is carmine red, with a little indigo blue. W ","172,116,124",e03d55,"224,61,85","351,72,56",OK,Photoshop autotone and color balance adjust 100px eyedropper sample,https://archive.org/download/gri_c00033125012743312/gri_c00033125012743312_jp2.zip/gri_c00033125012743312_jp2%2Fgri_c00033125012743312_0069.jpg
94,Purplish Red,https://archive.org/stream/gri_c00033125012743312#page/n69/mode/1up,Outside of Quills of Terico,Dark Crimson Officinal Garden Rose,Precious Garnet,Red,"No. 94. Purplish Red, the columbine red of Werner, is carmine red, with a little Berlin blue, and a small portion of indigo blue. W.","90,46,71",8b0013,"139,0,19","352,100,27",OK,Photoshop autotone and color balance adjust 100px eyedropper sample,https://archive.org/download/gri_c00033125012743312/gri_c00033125012743312_jp2.zip/gri_c00033125012743312_jp2%2Fgri_c00033125012743312_0069.jpg
95,Cochineal Red,https://archive.org/stream/gri_c00033125012743312#page/n69/mode/1up,,Under Disk of decayed Leaves of None-so-pretty,Dark Cinnaber,Red,"95. Cochineal Red, is lake red mixed with bluish grey. W.","114,78,78",a70c17,"167,12,23","356,87,35",OK,Photoshop autotone and color balance adjust 100px eyedropper sample,https://archive.org/download/gri_c00033125012743312/gri_c00033125012743312_jp2.zip/gri_c00033125012743312_jp2%2Fgri_c00033125012743312_0069.jpg
96,Veinous Blood Red,https://archive.org/stream/gri_c00033125012743312#page/n69/mode/1up,Veinous Blood,Musk Flower or dark Purple Scaious,Pyrope,Red,"96. Veinous Blood Red, is carmine red mixed with brownish black. W.","64,56,55",630108,"99,1,8","356,98,20",OK,Photoshop autotone and color balance adjust 100px eyedropper sample,https://archive.org/download/gri_c00033125012743312/gri_c00033125012743312_jp2.zip/gri_c00033125012743312_jp2%2Fgri_c00033125012743312_0069.jpg
97,Brownish Purple Red,https://archive.org/stream/gri_c00033125012743312#page/n69/mode/1up,,Flower of deadly Nightshade,Red Antimony Ore,Red,"97. Brownish Purple Red, the cherry red of Werner, is lake red mixed with brownish black, and a small portion of grey. W. ","136,116,112",c03c45,"192,60,69","356,52,49",OK,Photoshop autotone and color balance adjust 100px eyedropper sample,https://archive.org/download/gri_c00033125012743312/gri_c00033125012743312_jp2.zip/gri_c00033125012743312_jp2%2Fgri_c00033125012743312_0069.jpg
98,Chocolate Red,https://archive.org/stream/gri_c00033125012743312#page/n69/mode/1up,Breast of Bird of Paradise,Brown Disk of common Marigold,,Red,"98. Chocolate Red, is veinous blood red mixed with a little brownish red.","76,60,61",750209,"117,2,9","356,97,23",OK,Photoshop autotone and color balance adjust 100px eyedropper sample,https://archive.org/download/gri_c00033125012743312/gri_c00033125012743312_jp2.zip/gri_c00033125012743312_jp2%2Fgri_c00033125012743312_0069.jpg
99,Brownish Red,https://archive.org/stream/gri_c00033125012743312#page/n69/mode/1up,Mark on Throat of Red-throated Diver,,Iron Flint,Red,"99. Brownish Red, is chocolate red mixed with hyacinth red, and a little chesnut brown. W.","101,62,54",9a0407,"154,4,7","359,95,31",OK,Photoshop autotone and color balance adjust 100px eyedropper sample,https://archive.org/download/gri_c00033125012743312/gri_c00033125012743312_jp2.zip/gri_c00033125012743312_jp2%2Fgri_c00033125012743312_0069.jpg
